<?xml version="1.0" encoding="utf-8" ?>
<!DOCTYPE blocks SYSTEM "blocks.dtd">
<blocks>
    <block id="air">
        <properties>
            <lighting transparent="true"/>
            <collision empty="true" passthrough="true"/>
        </properties>
    </block>
    <block id="stone">
        <properties>
            <mining tool="pickaxe" tier="wooden" hardness="1.5" blast-resistance="6"/>
        </properties>
    </block>
    <block id="granite">
        <properties>
            <mining tool="pickaxe" tier="wooden" hardness="1.5" blast-resistance="6"/>
        </properties>
    </block>
    <block id="polished_granite">
        <properties>
            <mining tool="pickaxe" tier="wooden" hardness="1.5" blast-resistance="6"/>
        </properties>
    </block>
    <block id="diorite">
        <properties>
            <mining tool="pickaxe" tier="wooden" hardness="1.5" blast-resistance="6"/>
        </properties>
    </block>
    <block id="polished_diorite">
        <properties>
            <mining tool="pickaxe" tier="wooden" hardness="1.5" blast-resistance="6"/>
        </properties>
    </block>
    <block id="andesite">
        <properties>
            <mining tool="pickaxe" tier="wooden" hardness="1.5" blast-resistance="6"/>
        </properties>
    </block>
    <block id="polished_andesite">
        <properties>
            <mining tool="pickaxe" tier="wooden" hardness="1.5" blast-resistance="6"/>
        </properties>
    </block>
    <block id="grass">
        <properties>
            <mining tool="shovel" tier="any" hardness="0.6" blast-resistance="0.6"/>
            <flammable chance="60" spread="100"/>
        </properties>
        <attribute id="snowy"/>
        <traits>
            <connection>
                <relative-position at="up"/>
                <state block="snow_block"/>
                <state block="snow"/>
                <connect>
                    <state-attribute id="snowy" value="true"/>
                </connect>
                <disconnect>
                    <state-attribute id="snowy" value="false"/>
                </disconnect>
            </connection>
            <connection tags="fluid">
                <relative-position at="up"/>
                <solid-block>
                    <relative-position at="down"/>
                    <except>
                        <state block="snow"/>
                    </except>
                </solid-block>
                <connect>
                    <replace-self>
                        <state block="dirt"/>
                    </replace-self>
                </connect>
            </connection>
            <tool-conversion tool="shovel">
                <state block="grass_path"/>
            </tool-conversion>
            <tool-conversion tool="hoe">
                <state block="farmland"/>
            </tool-conversion>
            <spread-block source-light="9" horizontal-range="1" vertical-range="1" retries="4">
                <state block="grass" />
                <spread-to>
                    <state block="dirt"/>
                    <checking>
                        <relative-position at="up"/>
                        <is-not tags="liquid">
                            <solid-block/>
                        </is-not>
                    </checking>
                </spread-to>
            </spread-block>
        </traits>
    </block>
    <block id="mycelium">
        <properties>
            <mining tool="shovel" tier="any" hardness="0.6" blast-resistance="0.5"/>
        </properties>
        <attribute id="snowy"/>
        <traits>
            <connection>
                <relative-position at="up"/>
                <state block="snow_block"/>
                <state block="snow"/>
                <connect>
                    <state-attribute id="snowy" value="true"/>
                </connect>
                <disconnect>
                    <state-attribute id="snowy" value="false"/>
                </disconnect>
            </connection>
            <connection tags="fluid">
                <relative-position at="up"/>
                <solid-block>
                    <relative-position at="down"/>
                    <except>
                        <state block="snow"/>
                    </except>
                </solid-block>
                <connect>
                    <replace-self>
                        <state block="dirt"/>
                    </replace-self>
                </connect>
            </connection>
            <tool-conversion tool="shovel">
                <state block="grass_path"/>
            </tool-conversion>
            <tool-conversion tool="hoe">
                <state block="farmland"/>
            </tool-conversion>
            <spread-block source-light="9" horizontal-range="1" vertical-range="1" retries="4">
                <state block="grass" />
                <spread-to>
                    <state block="dirt"/>
                    <checking>
                        <relative-position at="up"/>
                        <is-not tags="liquid">
                            <solid-block/>
                        </is-not>
                    </checking>
                </spread-to>
            </spread-block>
        </traits>
    </block>
    <block id="dirt">
        <properties>
            <mining tool="shovel" tier="any" hardness="0.5" blast-resistance="0.5"/>
        </properties>
        <traits>
            <tool-conversion tool="hoe">
                <state block="farmland"/>
            </tool-conversion>
        </traits>
    </block>
    <block id="coarse_dirt">
        <properties>
            <mining tool="shovel" tier="any" hardness="0.5" blast-resistance="0.5"/>
        </properties>
    </block>
    <block id="podzol">
        <properties>
            <mining tool="shovel" tier="any" hardness="0.5" blast-resistance="0.5"/>
        </properties>
        <attribute id="snowy"/>
        <traits>
            <connection>
                <relative-position at="up"/>
                <state block="snow_block"/>
                <state block="snow"/>
                <connect>
                    <state-attribute id="snowy" value="true"/>
                </connect>
                <disconnect>
                    <state-attribute id="snowy" value="false"/>
                </disconnect>
            </connection>
        </traits>
    </block>
    <block id="cobblestone">
        <properties>
            <mining tool="pickaxe" tier="wooden" hardness="2" blast-resistance="6"/>
        </properties>
    </block>
    <block id="mossy_cobblestone">
        <properties>
            <mining tool="pickaxe" tier="wooden" hardness="2" blast-resistance="6"/>
        </properties>
    </block>
    <block id="planks">
        <name><attribute id="burnable_wood"/> Planks</name>
        <properties>
            <mining tool="axe" tier="any" hardness="2" blast-resistance="3"/>
            <flammable chance="5" spread="0" />
        </properties>
        <attribute id="burnable_wood"/>
    </block>
    <block id="fireproof_planks">
        <name><attribute id="fireproof_wood"/> Planks</name>
        <properties>
            <mining tool="axe" tier="any" hardness="2" blast-resistance="3"/>
            <fireproof/>
        </properties>
        <attribute id="fireproof_wood"/>
    </block>
    <block id="sapling">
        <name><attribute id="burnable_wood"/> Sapling</name>
        <properties>
            <mining tool="any" tier="any" hardness="0" blast-resistance="0"/>
            <lighting transparent="true"/>
            <waterlogging flowing="pops" source="pops"/>
            <!-- TODO -->
            <hitbox min-x="" min-y="" min-z="" max-x="" max-y="" max-z="" />
            <collision empty="true" passthrough="true" />
            <support>
                <supported-by>
                    <relative-position at="down"/>
                    <state block="dirt"/>
                    <state block="podzol"/>
                    <state block="grass"/>
                    <state block="farmland"/>
                </supported-by>
            </support>
        </properties>
        <attribute id="burnable_wood"/>
        <attribute id="sapling_age"/>
        <traits>
            <ages-up attribute="sapling_age"/>
            <grows-tree age="sapling_age" tree="burnable_wood"/>
        </traits>
        <state-override type="replace">
            <state-attribute id="burnable_wood" value="jungle" />
            <traits>
                <grows-tree age="sapling_age" tree="burnable_wood" area="2x2"/>
            </traits>
        </state-override>
        <state-override type="replace">
            <state-attribute id="burnable_wood" value="dark_oak" />
            <traits>
                <grows-tree age="sapling_age" tree="burnable_wood" area="2x2">
                    <support>
                        <supported-by>
                            <relative-position at="down"/>
                            <state block="dirt"/>
                            <state block="podzol"/>
                            <state block="grass"/>
                        </supported-by>
                    </support>
                </grows-tree>
            </traits>
        </state-override>
        <state-override type="replace">
            <state-attribute id="burnable_wood" value="acacia" />
            <traits>
                <grows-tree age="sapling_age" tree="burnable_wood">
                    <support>
                        <supported-by>
                            <relative-position at="down"/>
                            <state block="dirt"/>
                            <state block="podzol"/>
                            <state block="grass"/>
                        </supported-by>
                    </support>
                </grows-tree>
            </traits>
        </state-override>
        <state-override type="replace">